pmid,title,authors,pubdate,journal,abstract,year
18805301,[Narcolepsy with cataplexy].,Dauvilliers Y; Arnulf I,2008 Aug-Sep,Revue neurologique,"Narcolepsy is a rare, disabling sleep disorder, with a prevalence of 20 to 30 per 100,000. Its onset, from childhood to the fifties, peaks in the second decade. The main features are excessive daytime sleepiness and cataplexy or sudden loss of muscle tone triggered by emotional situations. Other less consistent symptoms include hypnagogic hallucinations, sleep paralysis, sleep maintenance insomnia, REM sleep behavior disorders, attention deficit and weight gain at disease onset. Narcolepsy with cataplexy remains a clinical diagnosis but nighttime and daytime polysomnography (multiple sleep latency tests) are useful to document a mean sleep latency below 8 min and at least two sleep-onset REM periods. HLA typing shows an association with HLA DQB1*0602 in more than 92% of cases but was not included in the new diagnostic criteria. In contrast, a low hypocretin levels (values below 110 pg/ml) in the cerebrospinal fluid (CSF) was highly specific for narcolepsy with cataplexy. The deficiency of the hypocretin system is well-established in animal models of narcolepsy (murine and canine narcolepsy) but also in human narcoleptics with a 90% reduction of CSF hypocretin levels in relation with an early loss of hypocretin neurons. The cause of human narcolepsy remains unknown, however an autoimmune process is most probable. The treatment of narcolepsy includes stimulants against sleepiness (modafinil, methylphenidate), anticataplectic drugs (antidepressants) and sodium oxybate. The current therapeutic target is oriented towards hypocretine agonists, histamine (an arousal system) H3 antagonists and immunosuppressants.",2008.0
18769859,Intravenous high-dose immunoglobulin treatment in recent onset childhood narcolepsy with cataplexy.,Plazzi G; Poli F; Franceschini C; Parmeggiani A; Pirazzoli P; Bernardi F; Mignot E; Cicognani A; Montagna P,2008 Oct,Journal of neurology,"We report on the outcome of intravenous high-dose immunoglobulin (IVIg) treatment in four children with narcolepsy and cataplexy, in whom the early diagnosis and the extreme disease severity were indications for this potentially efficacious therapy. One of four patients showed an objective and persistent improvement in clinical features during and after IVIg treatment. Our data partially support the recent report of the efficacy of IVIg treatment in early diagnosed narcolepsy with cataplexy and support the need for a controlled multicenter clinical trial on IVIg in narcolepsy.",2008.0
18714344,Elevated peripheral visfatin levels in narcoleptic patients.,Dahmen N; Manderscheid N; Helfrich J; Musholt PB; Forst T; Pfützner A; Engel A,2008 Aug 20,PloS one,"Narcolepsy is a severe sleep disorder that is characterized by excessive daytime sleepiness, cataplexies and a tendency towards obesity. Recent discoveries indicate that the major pathophysiology is a loss of hypocretin (orexin) producing neurons due to immunologically mediated degeneration. Visfatin is a recently described proinflammatory adipokine. It is identical to the immune modulating pre-B-cell colony enhancing factor (PBEF). Our study examines the hypothesis that visfatin levels are altered in narcoleptic patients.

For the analysis, a total of n = 54 patients (n = 18 males and n = 36 females) with the diagnosis of narcolepsy according to DSM-IV and the International Classification of Sleep Disorders were examined (BMI mean 30.3+/-5.5, age mean 52.5+/-16.1 years). As a control group 39 unrelated (n = 12 males and n = 27 females) healthy volunteers with no sleep disorder according to DSM-IV were included (BMI mean 28.5+/-4.6, age mean 51.1+/-13.6 years). Peripheral visfatin levels were measured using a commercial enzyme immunoassay kit with a measurement range from 0.1-1000 ng/ml. Narcolepsy symptoms, severity and frequency of symptoms as well as the total duration of various aspects of the symptomatology were assessed by unstructured and structured clinical interviews in including the Stanford Center for Narcolepsy Sleep Inventory.

Circulating visfatin was found to be significantly increased in HLA DR2 positive narcoleptic patients compared to controls.

Taken together, our results add to the evidence of disturbed immunological regulation in patients with narcolepsy.",2008.0
18684353,"Stay awake! Understanding, diagnosing, and successfully managing narcolepsy.",Doghramji PP; Lieberman JA 3rd; Gordon ML,2007 Nov,The Journal of family practice,"Sleep is a physiologic state that performs an essential restorative function and facilitates learning and memory consolidation. When sleep is disrupted for more than a short time, normal daily functions decline. Mood, attention, and behavior deteriorate. Sleepiness and disrupted sleep can result from a large number of pathological disorders. Currently, 88 sleep disorders are listed in the International Classification of Sleep Disorders, as established by the American Academy of Sleep Medicine, and sleep disorders adversely affect more than an estimated 70 million Americans. Most of these disorders can be classified as causing insomnia and/or hypersomnia. Insomnia results from disorders that cause difficulty with falling asleep and staying asleep; examples are hyperarousal, circadian dysrhythmia, and homeostatic dysregulation. In contrast, hypersomnia refers to difficulty in staying awake and is characterized by recurrent episodes of excessive daytime sleepiness or prolonged nighttime sleep. Hypersomnia can result from several primary sleep disorders, including narcolepsy, sleep apnea, restless legs syndrome, idiopathic hypersomnia, and periodic limb movement disorder. The effects of some of these sleep disorders and other chronic illnesses on daytime sleepiness are measured using the Epworth Sleepiness Scale. Narcolepsy was found to cause some of the highest measures of excessive sleepiness. This supplement uses a case-based approach to describe the underlying pathology and symptoms of narcolepsy. Differential diagnosis of narcolepsy and current treatment options will be discussed.",2007.0
18677186,Interrater and intrarater reliability in multiple sleep latency test.,Chen L; Ho CK; Lam VK; Fong SY; Li AM; Lam SP; Wing YK,2008 Aug,Journal of clinical neurophysiology : official publication of the American Electroencephalographic Society,"Multiple sleep latency test (MSLT) remains the golden standard for the clinical diagnosis and management of excessive daytime sleepiness. However, there was limited data on the reliability measurement of MSLT. Forty-four (M/F ratio: 26/18, mean age of 43.4 +/- 13.9 years) subjects of an ongoing family study of narcolepsy underwent a standard polysomnogram and MSLT. Three trained staff of various level of experiences independently and blindly scored each nap (n = 219). To test for intrarater reliability, 100 naps (n = 20 subjects) were re-scored half a year later. The interrater reliability for the mean sleep latency of 5 naps, sleep latency, and rapid eye movement (REM) sleep latency of individual nap, presence and numbers of sleep onset REM periods varied from the range of 0.668 to 0.964. The mean interrater reliability for the clinical diagnosis of narcolepsy was 0.883 (range, 0.824-0.938), whereas it was 0.750 (range, 0.674-0.858) for the diagnosis of narcolepsy spectrum disorder (shortened mean sleep latency and/or the presence of sleep onset REM periods) and 0.796 (range, 0.697-0.846) for normal cases. The intrarater reliability for the sleep latency and sleep onset REM periods varied from the range of 0.625 to 0.991. Our study demonstrated excellent inter- and intrarater reliability in scoring the sleep latency and sleep onset REM periods of MSLT. They also had excellent agreement on the diagnosis of narcolepsy and an ""excellent to good"" agreement on the diagnosis of narcolepsy spectrum disorder and normal cases. Our study lent further support that MSLT was an objective measurement with high inter- and intrarater reliability across various sleep disorders and healthy controls among different sleep centers.",2008.0
18663247,Prevalence of sleep disturbance in closed head injury patients in a rehabilitation unit.,Makley MJ; English JB; Drubach DA; Kreuz AJ; Celnik PA; Tarwater PM,2008 Jul-Aug,Neurorehabilitation and neural repair,"Traumatic brain injury (TBI) is a leading cause of disability in young people in the United States. Disorders of arousal and attention are common in closed head injury (CHI). Daytime drowsiness impairs participation in rehabilitation, whereas nighttime wakefulness leads to falls and behavioral disturbances. Sleep disturbances in TBI reported in the literature have included excessive daytime somnolence, sleep phase cycle disturbance, narcolepsy, and sleep apnea. Although well known to the clinician treating these patients, the extent and prevalence of disrupted sleep in patients in an acute inpatient rehabilitation unit has not been described.

To determine the prevalence of sleep wake cycle disturbance (SWCD) in patients with CHI in a TBI rehabilitation unit.

Prospective observational.

Inpatient specialized brain injury rehabilitation unit. Patients. Thirty-one consecutive admissions to a brain injury rehabilitation unit with the diagnosis of CHI.

Twenty-one patients (68%) had aberrations of nighttime sleep. There was no significant difference in Glasgow Coma Score on admission to trauma nor was there any significant difference in age between the affected and unaffected groups. Patients with SWCD had longer stays in both the trauma center (P < .003) and the rehabilitation center (P < .03).

There is a high prevalence of SWCD in CHI patients admitted to a brain injury rehabilitation unit. Patients with SWCD have longer stays in both acute and rehabilitation settings and may be a marker for more severe injury.",2008.0
18624787,Gray matter deficits in young adults with narcolepsy.,Kim SJ; Lyoo IK; Lee YS; Lee JY; Yoon SJ; Kim JE; Kim JH; Hong SJ; Jeong DU,2009 Jan,Acta neurologica Scandinavica,"The aim of this study was to investigate gray matter volume changes in narcolepsy.

An optimized voxel-based morphometry was conducted for 17 young adults with a sole diagnosis of human leukocyte antigen DQB(1) 0602 positive narcolepsy with cataplexy (26.6 +/- 5.2 years old) and 17 comparison subjects (24.6 +/- 4.9 years old) using 3 Tesla scanner. Gray matter volumes in the bilateral hypothalamic voxel of interests (VOI) were also calculated.

Compared with the comparison subjects, narcoleptic patients had gray matter volume decrease in the right hypothalamus and other regions including subcortical, prefrontal, limbic and occipital areas. Narcoleptic patients also had lower gray matter volume on predefined VOI at the bilateral hypothalamus, which correlated with the Ullanlinna Narcolepsy Scale score.

Current findings suggest that narcoleptic patients have structural abnormalities in hypothalamus, which might be related to the clinical manifestation of narcolepsy with cataplexy.",2009.0
18545775,Quality of life in patients with narcolepsy: a WHOQOL-bref study.,Rovere H; Rossini S; Reimão R,2008 Jun,Arquivos de neuro-psiquiatria,"To evaluate the perception of Quality of Life (QL) in Brazilian patients with narcolepsy.

40 adult patients aged between 20 and 72 years (mean=41.55; SD=14.50); (28 F; 12M), with the diagnosis of chronic narcolepsy were followed up at the outpatient clinic (Patient Group). The Control Group was composed of 40 adults. The instrument utilized was the World Health Organization Quality of Life (WHOQOL-BREF).

The two groups were homogeneous and no difference was found with regards to age, sex, and demographic characteristics. The perception of QL in physical, psychological and social domains showed lower scores in those patients with narcolepsy than in the control group (p<0.05). Concerning physical domain, all the aspects evaluated were significantly impaired, in patient group, including sleep satisfaction (p<0.001); energy for daily activities (p=0.039); capacity to perform activities (p=0.001); and capacity to work (p=0.001).

The perception of QL showed severe impairment in patients with narcolepsy for physical, psychological and social domains.",2008.0
18446698,[Advances in the diagnosis and treatment of narcolepsy-cataplexy syndrome].,de Vicente Alvarez-Manzaneda EE,2008 May 1-15,Revista de neurologia,"Narcolepsy is a disabling sleep disorder that is characterised by excessive daytime sleepiness and abnormal manifestations in REM (rapid eye movement) sleep that include, among other symptoms, cataplexy (the sudden loss of muscle tone triggered by strong emotions). Studies on the prevalence of narcolepsy-cataplexy in Europe and the United States have yielded a figure of 0.013-0.067% in the general population. Although its prevalence is low, it is probably under-diagnosed for a number of different reasons, the most important perhaps being the difficulties involved in its diagnosis.

Because its diagnosis is essentially clinical, complementary tests can often be very helpful. Today, it is one of the most extensively studied sleep disorders at the molecular level. Human narcolepsy is associated with diminished hypocretin/orexin concentrations, unlike the case of canine narcolepsy, where mutations in the Hcrt receptor have been found. The treatment of narcolepsy must be tailored to meet the needs of each patient after an individual analysis of his or her symptoms. Daytime sleepiness can be controlled by drugs that stimulate the central nervous system, the most common being methylphenidate and modafinil. Cataplexy is usually treated with tricyclic antidepressants and selective serotonin reuptake inhibitors. The appearance of new drugs like sodium oxybate sheds a ray of light on the dark horizon of patients with narcolepsy-cataplexy syndrome.

Early identification of excessive daytime sleepiness by primary care physicians and specialists is essential for a better management and follow-up of these patients.",2008.0
18410846,Narcolepsy in children: a single-center clinical experience.,Vendrame M; Havaligi N; Matadeen-Ali C; Adams R; Kothare SV,2008 May,Pediatric neurology,"Although the initial manifestations of narcolepsy in children may differ from those with adult onset, hypersomnia remains the most common presenting sign. This study aimed to (1) describe the clinical and polysomnographic features, and treatment outcomes, of a group of children with narcolepsy, and (2) describe other sleep disorders to be considered in the differential diagnosis of hypersomnia and which may coexist with narcolepsy. A retrospective review of 125 children referred in 1 year for hypersomnia revealed 20 patients (16%) with narcolepsy. Of these, only 15% exhibited cataplexy, 10% experienced hallucinations, and none manifested sleep paralysis. Eighty-five percent of children with narcolepsy had sleep-disordered breathing on polysomnography. Body mass indices of these children were higher than for healthy, age-matched controls subjects. Other polysomnography findings included periodic limb movements of sleep (25%) and parasomnias (5%). The multiple sleep latency test revealed a mean sleep latency of 6.14 minutes, with sleep-onset rapid eye movement periods (median, 2/5 naps). Treatment with modafinil and sodium oxybate provided optimal control of daytime sleepiness. Physicians should routinely screen for hypersomnia in children by obtaining a detailed history and, in appropriate situations, ordering polysomnographic testing to rule out narcolepsy and other causes of hypersomnia.",2008.0
18375081,Pediatric narcolepsy.,Peterson PC; Husain AM,2008 Nov,Brain & development,"Narcolepsy is a disabling disease with a prevalence of 0.05%. It is characterized by excessive daytime sleepiness, cataplexy, sleep paralysis, hypnogogic hallucinations, automatic behavior, and disrupted nocturnal sleep. The presentation can be very variable, making diagnosis difficult. Loss of hypocretin containing neurons in the lateral hypothalamus has been noted in autopsy studies, and the cerebrospinal fluid level of hypocretin is reduced in patients with narcolepsy with cataplexy. New treatment options are available for the many symptoms of this disease. Early recognition and treatment can greatly improve the quality of life of patients with narcolepsy. A detail review of the epidemiology, pathophysiology, and management of narcolepsy in children is presented.",2008.0
18363311,Hypocretin and human African trypanosomiasis.,Dauvilliers Y; Bisser S; Chapotot F; Vatunga G; Cespuglio R; Josenando T; Buguet A,2008 Mar,Sleep,"To detail clinical and polysomnographic characteristics in patients affected with Trypanosoma brucei gambiense (Tb.g.) human African trypanosomiasis (HAT) at different stages of evolution and to measure and compare cerebrospinal fluid (CSF) levels of hypocretin-1 with narcoleptic patients and neurologic controls.

Twenty-five untreated patients affected with T.b.g. HAT were included. The patients were evaluated using a standardized clinical evaluation and a specific interview on sleep complaints. Diagnosis of stages I and II and intermediate stage was performed by CSF cell count and/or presence of trypanosomes: 4 patients were classified as stage II, 13 stage I, and 8 ""intermediate"" stage. Seventeen untreated patients completed continuous 24-hour polysomnography. We measured CSF levels of hypocretin-1 in all patients at different stages and evolutions, and we compared the results with 26 patients with narcolepsy-cataplexy and 53 neurologic controls.

CSF hypocretin-1 levels were significantly higher in T.b.g. HAT (423.2 +/- 119.7 pg/mL) than in narcoleptic patients (40.16 +/- 60.18 pg/ mL) but lower than in neurologic controls (517.32 +/- 194.5 pg/mL). One stage I patient had undetectable hypocretin levels and 1 stage II patient showed intermediate levels, both patients (out of three patients) reporting excessive daytime sleepiness but without evidence for an association with narcolepsy. No differences were found in CSF hypocretin levels between patients with HAT stages; however, the presence of major sleep-wake cycle disruptions was significantly associated with lower CSF hypocretin-1 level with a same tendency for the number of sleep-onset rapid eye movement periods.

The present investigation is not in favor of a unique implication of the hypocretin system in T.b.g. HAT. However, we propose that dysfunction of the hypothalamic hypocretin region may participate in sleep disturbances observed in African trypanosomiasis.",2008.0
18363310,Increased GABA levels in medial prefrontal cortex of young adults with narcolepsy.,Kim SJ; Lyoo IK; Lee YS; Sung YH; Kim HJ; Kim JH; Kim KH; Jeong DU,2008 Mar,Sleep,"To explore absolute concentrations of brain metabolites including gamma amino-butyric acid (GABA) in the medial prefrontal cortex and basal ganglia of young adults with narcolepsy.

Proton magnetic resonance (MR) spectroscopy centered on the medial prefrontal cortex and the basal ganglia was acquired. The absolute concentrations of brain metabolites including GABA and glutamate were assessed and compared between narcoleptic patients and healthy comparison subjects.

Sleep and Chronobiology Center at Seoul National University Hospital; A high strength 3.0 Tesla MR scanner in the Department of Radiology at Seoul National University Hospital.

Seventeen young adults with a sole diagnosis of HLA DQB1 0602 positive narcolepsy with cataplexy (25.1 +/- 4.6 years old) and 17 healthy comparison subjects (26.8 +/- 4.8 years old).

N/A.

Relative to comparison subjects, narcoleptic patients had higher GABA concentration in the medial prefrontal cortex (t = 4.10, P <0.001). Narcoleptic patients with nocturnal sleep disturbance had higher GABA concentration in the medial prefrontal cortex than those without nocturnal sleep disturbance (t = 2.45, P = 0.03), but had lower GABA concentration than comparison subjects (t = 2.30, P = 0.03).

The current study reports that young adults with narcolepsy had a higher GABA concentration in the medial prefrontal cortex, which was more prominent in patients without nocturnal sleep disturbance. Our findings suggest that the medial prefrontal GABA level may be increased in narcolepsy, and the increased medial prefrontal GABA might be a compensatory mechanism to reduce nocturnal sleep disturbances in narcolepsy.",2008.0
18343568,Narcolepsy presenting as REM sleep behaviour disorder.,Bonakis A; Howard RS; Williams A,2008 May,Clinical neurology and neurosurgery,"REM sleep behaviour disorder (RBD) is a neurological condition well known to be associated with the synucleinopathies in middle-aged patients. However, there is much less data concerning its development, evolution, and association with other disorders in younger patients. We report two patients aged less than 33 years who presented with clinical and polysomnographical features of RBD, both of whom proved to have previously undiagnosed narcolepsy. Whilst the association of narcolepsy with RBD has been previously recognised, this is the first report of narcoleptic patients presenting with RBD. Narcolepsy should be included in the differential diagnosis of young patients presenting with abnormal behaviour during sleep compatible with RBD.",2008.0
18307264,Cataplexy features in childhood narcolepsy.,Serra L; Montagna P; Mignot E; Lugaresi E; Plazzi G,2008 Apr 30,Movement disorders : official journal of the Movement Disorder Society,"Cataplexy, the hallmark of narcolepsy, has been well characterized in adults but not in children. This study systematically used structured clinical assessments and video-recordings (49 episodes in eight cases) to evaluate cataplexy in 23 patients diagnosed before the age of 18 years. Forty-three percent of patients had falls as part of their attacks. During cataplexy knees, head, and jaw were the most frequently compromised body segments; eyelids, arms, and trunk being less commonly involved. More rarely, blurred vision, slurred speech, irregular breathing, or a sudden loss of smiling mimics were reported. One-third of the sample presented with a previously unrecognized description of cataplexy that we coined ""cataplectic facies,"" consisting of a state of semipermanent eyelid and jaw weakness, on which partial or complete cataplectic attacks were superimposed. The usual triggering emotions, such as laughter, joking, or anger, were not always present, especially when close to an abrupt onset, hampering diagnosis. Video-recordings of cataplectic attacks may be useful to document the attack, allowing a comparison with archived presentations.",2008.0
18246980,Practice parameters for the treatment of narcolepsy and other hypersomnias of central origin.,Morgenthaler TI; Kapur VK; Brown T; Swick TJ; Alessi C; Aurora RN; Boehlecke B; Chesson AL Jr; Friedman L; Maganti R; Owens J; Pancer J; Zak R; Standards of Practice Committee of the American Academy of Sleep Medicine,2007 Dec,Sleep,"These practice parameters pertain to the treatment of hypersomnias of central origin. They serve as both an update of previous practice parameters for the therapy of narcolepsy and as the first practice parameters to address treatment of other hypersomnias of central origin. They are based on evidence analyzed in the accompanying review paper. The specific disorders addressed by these parameters are narcolepsy (with cataplexy, without cataplexy, due to medical condition and unspecified), idiopathic hypersomnia (with long sleep time and without long sleep time), recurrent hypersomnia and hypersomnia due to medical condition. Successful treatment of hypersomnia of central origin requires an accurate diagnosis, individual tailoring of therapy to produce the fullest possible return of normal function, and regular follow-up to monitor response to treatment. Modafinil, sodium oxybate, amphetamine, methamphetamine, dextroamphetamine, methylphenidate, and selegiline are effective treatments for excessive sleepiness associated with narcolepsy, while tricyclic antidepressants and fluoxetine are effective treatments for cataplexy, sleep paralysis, and hypnagogic hallucinations; but the quality of published clinical evidence supporting them varies. Scheduled naps can be beneficial to combat sleepiness in narcolepsy patients. Based on available evidence, modafinil is an effective therapy for sleepiness due to idiopathic hypersomnia, Parkinson's disease, myotonic dystrophy, and multiple sclerosis. Based on evidence and/or long history of use in the therapy of narcolepsy committee consensus was that modafinil, amphetamine, methamphetamine, dextroamphetamine, and methylphenidate are reasonable options for the therapy of hypersomnias of central origin.",2007.0
18078359,"Narcolepsy and excessive daytime sleepiness: diagnostic considerations, epidemiology, and comorbidities.",Benca RM,2007,The Journal of clinical psychiatry,"Narcolepsy is a chronic, neurologic disorder that has severe disabling effects on affected patients. It usually becomes manifest between the ages of 10 and 25 years and is recognized by a tetrad of symptoms that includes excessive daytime sleepiness, cataplexy, sleep paralysis, and hypnagogic hallucinations. Excessive daytime sleepiness is common and associated with a broad range of medical, sleep, and psychiatric disorders; therefore, accurate diagnosis of narcolepsy and comorbid disorders is important for optimal treatment response.",2007.0
