pmid,title,authors,pubdate,journal,abstract,year
40365808,"[Overlap between PTSD, ADHD, and narcolepsy].",Mariager T; Speyer H; Ponsaing L,2025 May 12,Ugeskrift for laeger,,2025.0
40220529,Clinical challenges in narcolepsy: From delayed diagnosis to daytime function impairments during treatment.,Inoue Y; Kumagai T; Shoji A; Kokubo K; Honda M,2025 Jul,Sleep medicine,,2025.0
40157243,Sex effect on time to diagnosis and clinical features of narcolepsy type 1 and 2.,Fernandes M; Calvello C; Placidi F; Izzi F; Castelli A; Pagano A; Mercuri NB; Liguori C,2025 Jun,Sleep medicine,,2025.0
40120323,Characterization and treatment patterns of patients treated with immediate-release sodium oxybate for narcolepsy: A propensity score-matched cohort study.,Lipford MC; Asfahan S; Singh GP; Moore JL; Tippmann-Peikert M; Kumar-M P; Ip W; Awasthi S; Gudeman J; Krahn L,2025 May,Journal of clinical neuroscience : official journal of the Neurosurgical Society of Australasia,,2025.0
40111736,"A Survey of People Living with Narcolepsy in the USA: Path to Diagnosis, Quality of Life, and Treatment Landscape from the Patient's Perspective.",Ortiz LE; Morse AM; Krahn L; Lavender M; Horsnell M; Cronin D; Schneider B; Gudeman J,2025 Mar,CNS drugs,,2025.0
40088861,"Phenotypic clusters of narcolepsy type 1: Insights from age of onset, weight gain, sleep patterns, and impulsivity.",Mengmeng W; Lanbo W; Weihan W; Xiaosong D; Fang H; Spruyt K; Fulong X,2025 Jun,Sleep medicine,,2025.0
40080737,Use of Portable 24-Hour Polysomnography as Alternative Diagnostic Tool for Narcolepsy Type 1 in Adults and Children.,Biscarini F; Vandi S; Zenesini C; Vignatelli L; Citeroni F; Antelmi E; Franceschini C; Barateau L; Dauvilliers Y; Mignot E; Plazzi G; Pizza F,2025 Apr 8,Neurology,,2025.0
39943847,Effort/reward imbalance and comorbidities burden in academic and professional careers of patients with narcolepsy type 1.,Peter-Derex L; Fort E; Putois B; Martel N; Ricordeau F; Bastuji H; Arnulf I; Barateau L; Bourgin P; Dauvilliers Y; Debs R; Dodet P; Dudoignon B; Franco P; Hartley S; Lambert I; Lecendreux M; Leclair-Visonneau L; Léger D; Lemesle-Martin M; Léotard A; Leu-Semenescu S; Limousin N; Lopez R; Meslier N; Micoulaud-Franchi JA; Charley-Mocana C; d'Ortho MP; Philip P; Ruppert E; de La Tullaye S; Brigandet M; Margier J; Rolland B; Charbotel B; Mazza S,2025 Jun 1,Journal of clinical sleep medicine : JCSM : official publication of the American Academy of Sleep Medicine,,2025.0
39938170,An inter-rater variability study between human and automatic scorers in 5-s mini-epochs of sleep.,Follin LF; Zahid AN; Viste R; Vevelstad J; Kaufmann T; Ramm-Pettersen A; Juvodden HT; Hansen BH; Christensen JAE; Knudsen-Heier S,2025 Apr,Sleep medicine,,2025.0
39842621,Roles of cerebrospinal fluid metabolites in mediating the relationship between cathepsins and narcolepsy type 1: A comprehensive Mendelian randomization analysis.,Wu Y; Gan Q; Su X; Ding Y; Liu Q; Wang J; Zhang Y; Zhang N; Wu K,2025 Mar 20,Progress in neuro-psychopharmacology & biological psychiatry,,2025.0
39745488,Very late onset narcolepsy type 1: a case report and review of the literature.,Martens J; Van Den Bossche M,2025 May 1,Journal of clinical sleep medicine : JCSM : official publication of the American Academy of Sleep Medicine,,2025.0
39744411,First Episode Psychosis in a Teen with Narcolepsy and Cataplexy.,Sharma T; Kestner AC; Reddy A,2025 Jan 1,Psychopharmacology bulletin,,2025.0
39729629,Ofatumumab treatment in new-onset narcolepsy type 1 following SARS-CoV-2 infection.,Wang X; Zhang X; Yuan N; Liu Y,2025 Mar,Annals of clinical and translational neurology,,2025.0
39615274,Epidemiology of narcolepsy and idiopathic hypersomnia in Japan: A retrospective analysis of health insurance claims from the Japan Medical Data Center.,Kadotani H; Matsuo M; Tran L; Parsons VL; Maguire A; Crawford S; Ghosh S; Dave S,2025 Feb,Sleep medicine,,2025.0
39561673,Social support and isolation in narcolepsy and idiopathic hypersomnia: An international survey.,Flygare J; Oglesby L; Parthasarathy S; Thorpy MJ; Mignot E; Leary EB; Morse AM,2025 Jan,Sleep medicine,,2025.0
39533540,Sleep schedules and MSLT-based diagnosis of narcolepsy type 2 and idiopathic hypersomnia: Exploring potential associations in a large clinical sample.,Matsui K; Usui A; Takei Y; Kuriyama K; Inoue Y,2025 Jun,Journal of sleep research,,2025.0
39484812,The Lehigh Valley Health Network Narcolepsy Cohort: clinical and polysomnographic analysis of 304 cases.,Jiang RY; Rochart R; Chu I; Duka S; Vendrame M,2025 Mar 1,Journal of clinical sleep medicine : JCSM : official publication of the American Academy of Sleep Medicine,,2025.0
39466898,Hypnosis: An aid in working with patients with narcolepsy.,Kass LJ,2024 Nov,The American journal of clinical hypnosis,,2024.0
39462151,Patient experiences of narcolepsy and idiopathic hypersomnia in the Nordics: a patient journey map.,Vesinurm M; Dünweber C; Rimestad J; Landtblom AM; Jennum PJ,2025 Jun,Journal of sleep research,,2025.0
39437461,Connecting clinicians and patients: The language of narcolepsy.,Barateau L; Morse AM; Gill SK; Pizza F; Ruoff C,2024 Dec,Sleep medicine,,2024.0
39410793,International Swiss Primary Hypersomnolence and Narcolepsy Cohort Study (iSPHYNCS): the impact of psychiatric comorbidities on daily life in central disorders of hypersomnolence-a vicious circle.,Aktan Suzgun M; Wenz ES; van der Meer J; Fregolente LG; Warncke JD; Miano S; Acker J; Strub M; Olliges E; Khatami R; Schmidt MH; iSPHYNCS Investigators; Bassetti CLA; von Manitius S,2025 Jun,Journal of sleep research,,2025.0
39241492,Recent insights into the pathophysiology of narcolepsy type 1.,Vringer M; Zhou J; Gool JK; Bijlenga D; Lammers GJ; Fronczek R; Schinkelshoek MS,2024 Dec,Sleep medicine reviews,,2024.0
39226768,CSF-profile and hypocretin levels in children with narcolepsy type 1 and 2.,Josler M; El Naggar I; Bertolini A; Kutz P; Roll C; Wendel EM; Schlüter B; Hahn A; Siegert S; Hackenberg A; Zuberi SM; Otto M; Rostásy K,2024 Nov,European journal of paediatric neurology : EJPN : official journal of the European Paediatric Neurology Society,,2024.0
39177543,Increased Risk of New-Onset Hypertension in Patients With Narcolepsy Initiating Sodium Oxybate: A Real-World Study.,Ben-Joseph RH; Somers VK; Black J; D'Agostino RB Jr; Davis M; Macfadden W; Mues KE; Jackson C; Ni W; Cook MN; White WB,2024 Nov,Mayo Clinic proceedings,,2024.0
39168479,Loss of rapid eye movement atonia in rapid eye movement sleep behaviour disorder and narcolepsy.,Edlinger F; Böck M; Seidel S; Trimmel K,2025 Feb,Journal of sleep research,,2025.0
39154204,The actigraphic evaluation of daytime sleep in central disorders of hypersomnolence: comparison with polysomnography.,Biscarini F; Vandi S; Riccio C; Raggini L; Neccia G; Plazzi G; Pizza F,2024 Dec 11,Sleep,,2024.0
39150700,Insights from a 10-year Australasian idiopathic hypersomnia patient data registry study.,Anderson J; Yee BJ; Grunstein R; Matar E; Chadwick M; Machan E; Chapman J; Tai J; Saini B; Sivam S,2024 Dec 1,Journal of clinical sleep medicine : JCSM : official publication of the American Academy of Sleep Medicine,,2024.0
39032802,CSF dynamics of orexin and β-amyloid(42) levels in narcolepsy and Alzheimer's disease patients: a controlled study.,Lozano-Tovar S; Nuccetelli M; Placidi F; Izzi F; Sancesario G; Bernardini S; Biagio Mercuri N; Liguori C,2024 Aug 10,Neuroscience letters,,2024.0
38949661,Sequential Presentation of Obsessive-Compulsive Disorder and Narcolepsy in a 10-Year-Old Girl With Wolfram Syndrome 1.,Ravindren RK; Veettil RT; Athimannil S; Balaram N; Veedu PT; Veetil SA; Ayoor AK; Mathew S; Padinharath K; Balan S,2024 Jul 1,The Journal of nervous and mental disease,,2024.0
38875396,The value of using ELISA to detect orexin-A in cerebrospinal fluid in the diagnosis of narcolepsy.,Zhan Q; Deng L; Ding Y; Wang F; Han F; Zhou B; Xie L,2024 Jun 14,Medicine,,2024.0
38821567,"Accidental calcium, magnesium, potassium and sodium oxybates (Xywave) overdose: mistiming of a single night's narcolepsy medication leading to respiratory failure requiring mechanical ventilation.",McIntosh BW; Mayeux C,2024 May 31,BMJ case reports,,2024.0
38810481,Development and validation of a machine learning model for prediction of comorbid major depression disorder among narcolepsy type 1.,Pan Y; Zhang X; Wen X; Yuan N; Guo L; Shi Y; Jia Y; Guo Y; Hao F; Qu S; Chen Z; Yang L; Wang X; Liu Y,2024 Jul,Sleep medicine,,2024.0
38678310,Atypical isolated cataplexy: two case reports and a mini-review.,Mandagere V; Rayment D,2023 Jun,Neurocase,,2023.0
38665127,Identifying time-resolved features of nocturnal sleep characteristics of narcolepsy using machine learning.,Vilela M; Tracey B; Volfson D; Barateau L; Cai A; Buhl DL; Dauvilliers Y,2024 Dec,Journal of sleep research,,2024.0
38565187,"Narcolepsy: an interface among neurology, immunology, sleep, and genetics.",Coelho FMS,2024 Jun,Arquivos de neuro-psiquiatria,,2024.0
38450539,Incidence of pediatric narcolepsy diagnosis and management: evidence from claims data.,Tang SH; Min J; Zhang X; Uwah E; Griffis HM; Cielo CM; Fiks AG; Mindell JA; Tapia IE; Williamson AA,2024 Jul 1,Journal of clinical sleep medicine : JCSM : official publication of the American Academy of Sleep Medicine,,2024.0
38341838,[Characteristics of narcolepsy in childhood].,Gaál V; Faludi B,2024 Feb 11,Orvosi hetilap,,2024.0
38320459,Microstructural White Matter Abnormalities in Children and Adolescents With Narcolepsy Type 1.,Hovi M; Roine U; Autti T; Heiskala H; Roine T; Kirjavainen T,2024 Apr,Pediatric neurology,,2024.0
38319900,Creation of a shortened version of the Sleep Disorders Questionnaire (SDQ).,Biard K; De Koninck J; Douglass AB,2024,PloS one,,2024.0
38286043,Is there a role for repeating the multiple sleep latency test across childhood when initially non-diagnostic?,Nisbet LC; Nixon GM; Anantharajah A; Davey MJ,2024 Mar,Sleep medicine,,2024.0
38284414,'It's like tumbleweeds everywhere': An Interpretative Phenomenological Analysis of the lived experience of being diagnosed with and living with narcolepsy.,Kilmartin B; Day W,2024 Oct,Journal of health psychology,,2024.0
38183289,The application of machine learning on brain imaging features of different narcolepsy subtypes.,Chin WC; Huang SY; Liu FY; Wang CH; Tang I; Hsiao IT; Huang YS,2024 Feb 8,Sleep,,2024.0
38173730,Case report: Excessive daytime sleepiness as a presenting manifestation of autoimmune glial fibrillary acidic protein astrocytopathy.,Tang M; Huang S; Guo W; Zhou J; Huang Z; Li W; Sun Q; Wang Z,2023,Frontiers in immunology,,2023.0
38165365,Role of Daytime Continuous Polysomnography in the Diagnosis of Pediatric Narcolepsy Type 1.,Pizza F; Vignatelli L; Vandi S; Zenesini C; Biscarini F; Franceschini C; Antelmi E; Ingravallo F; Mignot E; Bruni O; Nobili L; Veggiotti P; Ferri R; Plazzi G,2024 Jan 9,Neurology,,2024.0
38123241,Missed diagnosis of longstanding narcolepsy.,Chepke C,2023 Nov-Dec,Journal of psychiatry & neuroscience : JPN,,2023.0
38065636,Clinical Evaluation and Management of Narcolepsy in Children and Adolescents.,Dye TJ,2023 Dec,Seminars in pediatric neurology,,2023.0
37984842,"A case of monozygotic twins with hereditary spastic paraplegia type 4 and epilepsy, of whom only one developed narcolepsy type 1.",Mizuno Y; Uehara T; Nakamura Y; Okadome T; Mukaino T; Koh K; Takiyama Y; Kanbayashi T; Isobe N; Kira JI; Murai H; Shigeto H,2024 Aug,Journal of sleep research,,2024.0
37748251,Validation of the Brazilian Portuguese version of the Stanford cataplexy questionnaire.,Dias Gomes AC; Pimentel Filho LH; Aguilar ACR; Truzzi GM; Tufik S; Coelho FMS,2023 Nov,Sleep medicine,,2023.0
37740167,Harriet Tubman's Hypersomnia: Insights from Historical and Medical Perspectives.,Balmuth EA; Scammell TE,2023 Dec,Journal of general internal medicine,,2023.0
37684104,Idiopathic hypersomnia and Kleine-Levin syndrome.,Arnulf I; Dodet P; Leu-Semenescu S; Maranci JB,2023 Oct,Revue neurologique,,2023.0
37672382,Narcolepsy Diagnosis With Sleep Stage Features Using PSG Recordings.,Wang J; Zhao S; Zhou Y; Jiang H; Yu Z; Li T; Li S; Pan G,2023,IEEE transactions on neural systems and rehabilitation engineering : a publication of the IEEE Engineering in Medicine and Biology Society,,2023.0
37634997,"Narcolepsies, update in 2023.",Barateau L; Pizza F; Chenini S; Peter-Derex L; Dauvilliers Y,2023 Oct,Revue neurologique,,2023.0
37590830,Sleep Disorders in Childhood.,Shelton AR,2023 Aug 1,"Continuum (Minneapolis, Minn.)",,2023.0
37585269,Pharmacological options for narcolepsy: are they the way forward?,Abad VC,2023 Jul-Dec,Expert review of neurotherapeutics,,2023.0
37572055,Idiopathic hypersomnia years after the diagnosis.,Šonka K; Feketeová E; Nevšímalová S; Horvat EM; Příhodová I; Dostálová S; Galušková K; Milata M; Bušková J; Susta M,2024 Apr,Journal of sleep research,,2024.0
37544279,Repeated polysomnography and multiple sleep latency test in narcolepsy type 1 and other hypersomnolence disorders.,Torstensen EW; Haubjerg Østerby NC; Kornum BR; Wanscher B; Mignot E; Barløse M; Jennum PJ,2023 Oct,Sleep medicine,,2023.0
37539640,A series of 7 cases of patients with narcolepsy with hypocretin deficiency without the HLA DQB1*06:02 allele.,Miano S; Barateau L; De Pieri M; Riccardi S; Thevenin C; Manconi M; Dauvilliers Y,2023 Dec 1,Journal of clinical sleep medicine : JCSM : official publication of the American Academy of Sleep Medicine,,2023.0
37531449,Disentangling the complex landscape of sleep-wake disorders with data-driven phenotyping: A study of the Bernese center.,Aellen FM; Van der Meer J; Dietmann A; Schmidt M; Bassetti CLA; Tzovara A,2024 Jan,European journal of neurology,,2024.0
37477028,[Sleep paralysis during naptime as initial symptom of narcolepsy].,Villalobos-López P; Maldonado-Contreras A,2023 Jul 28,Revista de neurologia,,2023.0
37396177,Auxological and endocrine findings in narcolepsy type 1: seventeen-year follow-up from a pediatric endocrinology center.,Casale S; Assirelli V; Pizza F; Balsamo A; Gennari M; Pession A; Plazzi G; Cassio A,2023,Frontiers in endocrinology,,2023.0
37392083,Are unrefreshing naps associated with nocturnal sleep architecture specificities in idiopathic hypersomnia?,Mombelli S; Deshaies-Rugama AS; Blais H; Sekerovic Z; Thompson C; Desautels A; Montplaisir J; Nigam M; Carrier J; Gosselin N,2023 Nov 8,Sleep,,2023.0
37348285,Applicability of the Sustained Attention to Response Task (SART) in hypersomnolence: Experience and results from a tertiary referral center.,van der Hoeven AE; Bijlenga D; Bouhuijs P; van Schie MKM; Lammers GJ; Fronczek R,2023 Aug,Sleep medicine,,2023.0
37246794,The Burden of Narcolepsy in Adults: A Population Sampling Study Using Personal Media.,Quaedackers L; Van Gilst MM; Van Den Brandt I; Vilanova A; Lammers GJ; Markopoulos P; Overeem S,2024 Mar 3,Behavioral sleep medicine,,2024.0
37145499,What Is Narcolepsy?,Sum-Ping O; Mignot E,2023 May 23,JAMA,,2023.0
37069414,"Idiopathic Hypersomnia: Neurobiology, Diagnosis, and Management.",Morse AM; Naik S,2023 Apr,CNS drugs,,2023.0
37066739,Progressive narcolepsy: how to deal with intermediate hypocretin-1 values?,Ricordeau F; Bridoux A; Raverot V; Peter-Derex L,2023 Jul 1,Journal of clinical sleep medicine : JCSM : official publication of the American Academy of Sleep Medicine,,2023.0
36979356,LC-MS/MS-Based Proteomics Approach for the Identification of Candidate Serum Biomarkers in Patients with Narcolepsy Type 1.,Sanni A; Goli M; Zhao J; Wang J; Barsa C; El Hayek S; Talih F; Lanuzza B; Kobeissy F; Plazzi G; Moresco M; Mondello S; Ferri R; Mechref Y,2023 Feb 23,Biomolecules,,2023.0
36949713,[Narcolepsy Type 1 With Comorbid Schizophrenia: A Case Report].,Wang MO; Ma J; Li SX; Zhang L,2023 Mar,Sichuan da xue xue bao. Yi xue ban = Journal of Sichuan University. Medical science edition,,2023.0
36947322,Long-Term Safety and Tolerability During a Clinical Trial and Open-Label Extension of Low-Sodium Oxybate in Participants with Narcolepsy with Cataplexy.,Bogan RK; Foldvary-Schaefer N; Skowronski R; Chen A; Thorpy MJ,2023 Apr,CNS drugs,,2023.0
36870217,Muscle atonia index during multiple sleep latency test: A possible marker to differentiate narcolepsy from other hypersomnias.,Romigi A; Caccamo M; Testa F; Ticconi D; Cappellano S; Di Gioia B; Vitrani G; Rosenzweig I; Centonze D,2023 May,Clinical neurophysiology : official journal of the International Federation of Clinical Neurophysiology,,2023.0
36708258,Narcolepsy secondary to anti-Ma2 encephalitis: two case reports.,Brunet de Courssou JB; Testard P; Sallansonnet-Froment M; Brechemier ML; Ricard D; Psimaras D; Ferrand M; Maillet T; Depierre P; Ohlmann C; Capron J; Arnulf I; Gales A,2023 Apr 1,Journal of clinical sleep medicine : JCSM : official publication of the American Academy of Sleep Medicine,,2023.0
36608412,Approach to a sleepy child: Diagnosis and treatment of excessive daytime sleepiness in children and adolescents.,Bruni O,2023 Jan,European journal of paediatric neurology : EJPN : official journal of the European Paediatric Neurology Society,,2023.0
36564940,Anxiety and depression in patients with narcolepsy.,Abenza-Abildua MJ; Suárez-Gisbert E; Lores-Gutiérrez V; Algarra-Lucas C; Gómez-Aceña Á; Navacerrada-Barrero FJ; González-Martín L; Pérez-Villena A; Pérez-López C,2023 Aug,Journal of sleep research,,2023.0
36525847,"What, when and by whom? Adolescents' and parents' preferences concerning narcolepsy information.",Leprotti S; Audetto E; Zenesini C; Vignatelli L; Franceschini C; Pizza F; Plazzi G; Ingravallo F,2023 Jan,Sleep medicine,,2023.0
36427467,Repeated measures of hypocretin-1 in Danish and Italian patients with narcolepsy and in controls.,Torstensen EW; Haubjerg Østerby NC; Pizza F; Plazzi G; Antelmi E; Moresco M; Mignot E; Jørgensen NR; Christensen GL; Wanscher B; Kornum BR; Jennum PJ,2023 Jan,Sleep medicine,,2023.0
36001951,Towards an automatic narcolepsy detection on ambiguous sleep staging and sleep transition dynamics joint model.,Shen N; Luo T; Chen C; Zhang Y; Zhu H; Zhou Y; Wang Y; Chen W,2022 Sep 8,Journal of neural engineering,,2022.0
35953127,Orexin/hypocretin and major psychiatric disorders.,Lin CC; Huang TL,2022,Advances in clinical chemistry,,2022.0
35855527,Central disorders of hypersomnolence: diagnostic discrepancies between military and civilian sleep centers.,Thomas CL; Vattikuti S; Shaha D; Werner JK; Hansen S; Collen J; Capaldi VF; Williams S,2022 Oct 1,Journal of clinical sleep medicine : JCSM : official publication of the American Academy of Sleep Medicine,,2022.0
35733336,Pfizer/BioNTech SARS-CoV-2 vaccine as a potential trigger for the development of narcolepsy: a case report.,Mahamid A; Bornstein RJ; Amir H,2022 Oct 1,Journal of clinical sleep medicine : JCSM : official publication of the American Academy of Sleep Medicine,,2022.0
35698456,Adjustment to lockdown in children and adolescents with narcolepsy in France.,Pech de Laclause A; Konofal E; Bokov P; Delclaux C; Lecendreux M,2022 Sep 1,Journal of clinical sleep medicine : JCSM : official publication of the American Academy of Sleep Medicine,,2022.0
35659118,Automated classification of cyclic alternating pattern sleep phases in healthy and sleep-disordered subjects using convolutional neural network.,Murarka S; Wadichar A; Bhurane A; Sharma M; Acharya UR,2022 Jul,Computers in biology and medicine,,2022.0
35624073,Narcolepsy.,Barateau L; Pizza F; Plazzi G; Dauvilliers Y,2022 Aug,Journal of sleep research,,2022.0
35554594,Intermediate hypocretin-1 cerebrospinal fluid levels and typical cataplexy: their significance in the diagnosis of narcolepsy type 1.,van der Hoeven AE; Fronczek R; Schinkelshoek MS; Roelandse FWC; Bakker JA; Overeem S; Bijlenga D; Lammers GJ,2022 May 12,Sleep,,2022.0
35543223,Narcolepsy among first- and second-generation immigrants in Sweden: A study of the total population.,Wändell P; Fredrikson S; Carlsson AC; Li X; Sundquist J; Sundquist K,2022 Aug,Acta neurologica Scandinavica,,2022.0
35512685,Hypocretin-1 measurements in cerebrospinal fluid using radioimmunoassay: within and between assay reliability and limit of quantification.,van der Hoeven AE; van Waaij K; Bijlenga D; Roelandse FWC; Overeem S; Bakker JA; Fronczek R; Lammers GJ,2022 Jul 11,Sleep,,2022.0
35481446,Misdiagnosis of narcolepsy caused by a false-positive orexin-A/hypocretin-1 enzyme immune assay.,Sarkanen T; Sved G; Juujärvi M; Alakuijala A; Partinen M,2022 Aug 1,Journal of clinical sleep medicine : JCSM : official publication of the American Academy of Sleep Medicine,,2022.0
35465977,Changes in incidence rates of outcomes of interest in vaccine safety studies during the COVID-19 pandemic.,Xu S; Hong V; Sy LS; Glenn SC; Ryan DS; Morrissette KL; Nelson JC; Hambidge SJ; Crane B; Zerbo O; DeSilva MB; Glanz JM; Donahue JG; Liles E; Duffy J; Qian L,2022 May 20,Vaccine,,2022.0
35447401,"The REM-sleep-related characteristics of narcolepsy: a nation-wide multicenter study in Turkey, the REMCON study.",Akyildiz UO; Tezer FI; Koc G; Ismailogullari S; Demir AB; Ak AK; Sunter G; Kara KA; Berktas DT; Sahin A; Azman F; Akcay BD; Gok DK; Yilmaz H; Agan K; Bekmezci Y; Yetkin S; Aksu M; Karadeniz D; Senel GB,2022 Jun,Sleep medicine,,2022.0
35445831,"Narcolepsy: a model interaction between immune system, nervous system, and sleep-wake regulation.",Latorre D; Sallusto F; Bassetti CLA; Kallweit U,2022 Sep,Seminars in immunopathology,,2022.0
35426627,Common Sleep Disorders in Adults: Diagnosis and Management.,Holder S; Narula NS,2022 Apr 1,American family physician,,2022.0
35332869,Portrayals of narcolepsy from 1980 to 2020: a descriptive analysis of stigmatizing content in newspaper articles.,Varallo G; Pingani L; Musetti A; Galeazzi GM; Pizza F; Castelnuovo G; Plazzi G; Franceschini C,2022 Jul 1,Journal of clinical sleep medicine : JCSM : official publication of the American Academy of Sleep Medicine,,2022.0
35212159,Characterization of rapid weight gain phenotype in children with narcolepsy.,Zhang M; Thieux M; Inocente CO; Vieux N; Arvis L; Villanueva C; Lin JS; Plancoulaine S; Guyon A; Franco P,2022 Jun,CNS neuroscience & therapeutics,,2022.0
35184867,[Diagnostic strategy for hypersomnolence disorders].,Leclair-Visonneau L,2022 Jul,La Revue de medecine interne,,2022.0
35172921,Diagnosis and management of sleep disorders in Prader-Willi syndrome.,Duis J; Pullen LC; Picone M; Friedman N; Hawkins S; Sannar E; Pfalzer AC; Shelton AR; Singh D; Zee PC; Glaze DG; Revana A,2022 Jun 1,Journal of clinical sleep medicine : JCSM : official publication of the American Academy of Sleep Medicine,,2022.0
35088707,"Prevalence, incidence, and health care utilization of patients with narcolepsy: a population-representative study.",Kallweit U; Nilius G; Trümper D; Vogelmann T; Schubert T,2022 Jun 1,Journal of clinical sleep medicine : JCSM : official publication of the American Academy of Sleep Medicine,,2022.0
35040431,The Psychomotor Vigilance Test as a measure of alertness and sleep inertia in people with central disorders of hypersomnolence.,Trotti LM; Saini P; Bremer E; Mariano C; Moron D; Rye DB; Bliwise DL,2022 May 1,Journal of clinical sleep medicine : JCSM : official publication of the American Academy of Sleep Medicine,,2022.0
35038747,The diagnostic value of sleep and vigilance tests in central disorders of hypersomnolence.,Mathis J; Andres D; Schmitt WJ; Bassetti CL; Hess CW; Schreier DR,2022 Mar 14,Sleep,,2022.0
35034758,Sleep and homeostatic control of plasticity.,Lanza G; DelRosso LM; Ferri R,2022,Handbook of clinical neurology,,2022.0
35022128,Narcolepsy-like symptoms triggered by lemborexant in the context of hyperactive delirium in a patient with bipolar depression: a case report.,Shibata S; Oda Y; Ohki N; Ikemizu Y; Hayatsu R; Hirose Y; Iyo M,2022 May 1,Journal of clinical sleep medicine : JCSM : official publication of the American Academy of Sleep Medicine,,2022.0
34932852,Finnish children who experienced narcolepsy after receiving the Pandemrix vaccine during the 2009-2010 H1N1 pandemic demonstrated high level of psychosocial problems.,Hovi M; Heiskala H; Aronen ET; Saarenpää-Heikkilä O; Olsen P; Nokelainen P; Kirjavainen T,2022 Apr,"Acta paediatrica (Oslo, Norway : 1992)",,2022.0
34894325,Current Understanding of Narcolepsy 1 and its Comorbidities: What Clinicians Need to Know.,Krahn LE; Zee PC; Thorpy MJ,2022 Jan,Advances in therapy,"Narcolepsy is a chronic neurologic disorder associated with the dysregulation of the sleep-wake cycle that often leads to a decreased quality of life and results in a considerable health burden. There is often a delay to diagnosis of narcolepsy, mainly due to the lack of recognition of this disorder. One of the main factors hindering the diagnosis of narcolepsy is the association of comorbidities, which include other sleep disorders, psychiatric disorders, cardiovascular disorders, and metabolic disorders. The signs and symptoms of these comorbidities often overlap with those of narcolepsy, and some of the medications used for their treatment may obscure the symptoms of narcolepsy, leading to a delay in diagnosis. This review is targeted to clinicians unaccustomed to working with sleep disorders and aims to increase recognition and improve the management of narcolepsy.",2022.0
34852376,"""Weak with Laughter""-Cataplexy as a Hint for Early Diagnosis of Niemann-Pick Type C?",Leppmeier V; Veit S; Demund S; Makowski C; Kluger G,2022 Apr,Neuropediatrics,,2022.0
