pmid,title,authors,pubdate,journal,abstract,year
29449194,Prostaglandin D2 Receptor DP1 Antibodies Predict Vaccine-induced and Spontaneous Narcolepsy Type 1: Large-scale Study of Antibody Profiling.,Sadam H; Pihlak A; Kivil A; Pihelgas S; Jaago M; Adler P; Vilo J; Vapalahti O; Neuman T; Lindholm D; Partinen M; Vaheri A; Palm K,2018 Mar,EBioMedicine,"Neuropathological findings support an autoimmune etiology as an underlying factor for loss of orexin-producing neurons in spontaneous narcolepsy type 1 (narcolepsy with cataplexy; sNT1) as well as in Pandemrix influenza vaccine-induced narcolepsy type 1 (Pdmx-NT1). The precise molecular target or antigens for the immune response have, however, remained elusive.

Here we have performed a comprehensive antigenic repertoire analysis of sera using the next-generation phage display method - mimotope variation analysis (MVA). Samples from 64 children and adolescents were analyzed: 10 with Pdmx-NT1, 6 with sNT1, 16 Pandemrix-vaccinated, 16 H1N1 infected, and 16 unvaccinated healthy individuals. The diagnosis of NT1 was defined by the American Academy of Sleep Medicine international criteria of sleep disorders v3.

Our data showed that although the immunoprofiles toward vaccination were generally similar in study groups, there were also striking differences in immunoprofiles between sNT1 and Pdmx-NT1 groups as compared with controls. Prominent immune response was observed to a peptide epitope derived from prostaglandin D2 receptor (DP1), as well as peptides homologous to B cell lymphoma 6 protein. Further validation confirmed that these can act as true antigenic targets in discriminating NT1 diseased along with a novel epitope of hemagglutinin of H1N1 to delineate exposure to H1N1.

We propose that DP1 is a novel molecular target of autoimmune response and presents a potential diagnostic biomarker for NT1. DP1 is involved in the regulation of non-rapid eye movement (NREM) sleep and thus alterations in its functions could contribute to the disturbed sleep regulation in NT1 that warrants further studies. Together our results also show that MVA is a helpful method for finding novel peptide antigens to classify human autoimmune diseases, possibly facilitating the design of better therapies.",2018.0
29425380,The distinguishing motor features of cataplexy: a study from video-recorded attacks.,Pizza F; Antelmi E; Vandi S; Meletti S; Erro R; Baumann CR; Bhatia KP; Dauvilliers Y; Edwards MJ; Iranzo A; Overeem S; Tinazzi M; Liguori R; Plazzi G,2018 May 1,Sleep,"To describe the motor pattern of cataplexy and to determine its phenomenological differences from pseudocataplexy in the differential diagnosis of episodic falls.

We selected 30 video-recorded cataplexy and 21 pseudocataplexy attacks in 17 and 10 patients evaluated for suspected narcolepsy and with final diagnosis of narcolepsy type 1 and conversion disorder, respectively, together with self-reported attacks features, and asked expert neurologists to blindly evaluate the motor features of the attacks. Video documented and self-reported attack features of cataplexy and pseudocataplexy were contrasted.

Video-recorded cataplexy can be positively differentiated from pseudocataplexy by the occurrence of facial hypotonia (ptosis, mouth opening, tongue protrusion) intermingled by jerks and grimaces abruptly interrupting laughter behavior (i.e. smile, facial expression) and postural control (head drops, trunk fall) under clear emotional trigger. Facial involvement is present in both partial and generalized cataplexy. Conversely, generalized pseudocataplexy is associated with persistence of deep tendon reflexes during the attack. Self-reported features confirmed the important role of positive emotions (laughter, telling a joke) in triggering the attacks, as well as the more frequent occurrence of partial body involvement in cataplexy compared with pseudocataplexy.

Cataplexy is characterized by abrupt facial involvement during laughter behavior. Video recording of suspected cataplexy attacks allows the identification of positive clinical signs useful for diagnosis and, possibly in the future, for severity assessment.",2018.0
29425086,Transient neurologic syndromes: A diagnostic approach.,Abbatemarco JR; Rae-Grant AD,2018 Feb,Cleveland Clinic journal of medicine,"Clinicians are often confronted with patients who have transient neurologic symptoms lasting seconds to hours. In many of these patients, their symptoms have gone away or returned to baseline by the time of evaluation, making the diagnosis even more challenging. Elements such as correlation of symptoms with vascular territory, prodromes, triggers, motor symptoms, confusion, and sleep behavior can guide the diagnostic workup.",2018.0
29365206,Leg movement activity during sleep in school-age children and adolescents: a detailed study in normal controls and participants with restless legs syndrome and narcolepsy type 1.,Ferri R; DelRosso LM; Aricò D; Zucconi M; Ferini-Strambi L; Picchietti DL; Pizza F; Plazzi G; Manconi M; Bruni O,2018 Apr 1,Sleep,"To evaluate leg movement activity during sleep (LMS) in normal school-age children and adolescents, to eventually establish age-specific periodic LMS (PLMS) index thresholds that support the diagnosis of restless legs syndrome (RLS), and to evaluate the utility of other LMS indices.

Polysomnographic recordings from 61 controls, 46 children with RLS, and 44 children with narcolepsy type 1 (NT1) were analyzed for total leg movements (LMS), PLMS, and isolated leg movements (ISOLMS) duration and indices, separately for school-age children and adolescents. Moreover, intermovement interval (IMI) graphs and time-of-night distribution of LMS were analyzed, and cut-off thresholds for PLMS index and total LMS index were assessed for the separation of RLS from controls.

All indices tended to decrease from school-age children to adolescents in normal controls and in NT1, whereas in RLS, only PLMS index increased. All school-age children had a similar IMI distribution with a single peak at IMI 2-4 s followed by gradual decline. In adolescents with RLS, a second peak at IMI 10-50 s was seen. Time-of-night distribution of most indices decreased in RLS, whereas most tended to increase in NT1. A PLMS index cutoff of 2 per hour best differentiated RLS from controls in school-age children (accuracy 70.0%) and in adolescents (accuracy 70.8%); however, most participants with NT1 also showed PLMS indices higher than this threshold.

PLMS index alone does not reliably predict the diagnosis of RLS in children and adolescents. However, analyses of IMI distribution and time-of-night distribution provide additional elements to support a diagnosis of RLS.",2018.0
29351827,Nocturnal REM Sleep Without Atonia Is a Diagnostic Biomarker of Pediatric Narcolepsy.,Bin-Hasan S; Videnovic A; Maski K,2018 Feb 15,Journal of clinical sleep medicine : JCSM : official publication of the American Academy of Sleep Medicine,"Compare nocturnal REM sleep without atonia (nRWA) and REM sleep behavior disorder (RBD) between pediatric patients with and without narcolepsy and determine if the nRWA index is a valid diagnostic biomarker for narcolepsy.

Retrospective cohort study of children ages 6 to 18 years who completed a nocturnal polysomnogram (PSG) and Multiple Sleep Latency Test (MSLT). Our study sample included 11 patients with narcolepsy type 1 (NT1), 6 with narcolepsy type 2 (NT2), 12 with idiopathic hypersomnia (IH), and 11 with subjective hypersomnia (sHS). We compared group nRWA indices (epochs of RWA/total stage R sleep epochs) from the nocturnal PSGs and analyzed nRWA index receiver operating curve (ROC) statistics for narcolepsy diagnosis.

The median nRWA index of patients with NT1 was 15 to 30 times higher compared to sHS and IH (Ps < .005) but similar to that of the NT2 group (P = .46). RBD was present in 25% of patients with narcolepsy (NT1 and NT2). In comparing those with and without narcolepsy, the nRWA index area under the curve was 0.87 (0.6), 95% confidence interval (CI) = 0.75 to 0.99, P < .001. The threshold of having ≥ 1% of stage R sleep epochs with nRWA yielded a sensitivity of 88.2%, 95% CI = 63.6-98.5 and specificity of 60.9%, 95% CI = 38.5 to 80.3 for diagnosis of narcolepsy. In contrast, a threshold of ≥ 8% yielded a specificity of 95.7%, 95% CI = 78.1 to 99.9 and sensitivity of 52.9%, 95% CI = 27.8 to 77.

The nRWA index is a very good diagnostic biomarker of pediatric narcolepsy. Depending on the clinical cutoffs utilized, this biomarker can identify more children/adolescents with narcolepsy using just the PSG or reduce false-positive diagnostic results.",2018.0
29276000,A standardized test to document cataplexy.,Vandi S; Pizza F; Antelmi E; Neccia G; Iloti M; Mazzoni A; Avoni P; Plazzi G,2019 Jan,Sleep medicine,"Cataplexy is the pathognomonic symptom of narcolepsy type 1 (NT1). Since it is considered difficult to be directly observed or documented by clinicians, its diagnosis relies mainly on history taking. Our study aimed at testing the feasibility of a standardized video recording procedure under emotional stimulation to document cataplexy in the diagnostic work-up of suspected hypersomnia of central origin.

Two-hundred-eight consecutive patients underwent the diagnostic work-up and reached the final diagnosis of NT1 (n = 133), idiopathic hypersomnia or narcolepsy type 2 (IH/NT2 group, n = 33), or subjective excessive daytime sleepiness (sEDS group, n = 42). All subjects underwent a standardized video recording procedure while watching funny movies selected according to individual preferences, and a technician blind to clinical features reviewed the recordings to identify hypotonic phenomena that were finally confirmed by patients.

The video recording under emotional stimulation captured hypotonic phenomena in 72.2%, 9.1% and 4.8% of NT1, IH/NT2, and sEDS subjects (p < 0.0001), respectively. When tested against CSF hypocretin deficiency, the documentation of a hypotonic episode at the test showed an area under the ROC curve of 0.823 ± 0.033 (p < 0.0001). NT1 patients under anticataplectic medications showed less frequently hypotonic episodes than untreated ones (48.0% vs 77.8%, p = 0.003).

A standardized video recording procedure under emotional stimulation can help in the characterization of suspected hypersomnia of central origin. Further multi-center studies are warranted to extend the present findings and integrate a shared procedure for the laboratory work-up of narcolepsy.",2019.0
29215762,Risk of amphetamine use disorder and mortality among incident users of prescribed stimulant medications in the Veterans Administration.,Westover AN; Nakonezny PA; Halm EA; Adinoff B,2018 May,"Addiction (Abingdon, England)","Non-medical use of prescribed stimulant medications is a growing concern. This study's aims were to ascertain the demographics of stimulant medication users compared with non-users, examine temporal trends of stimulant medication use and estimate risk factors for development of amphetamine use disorder (AUD) and mortality among new users of stimulant medications.

Cox proportional hazards regression in a retrospective cohort adjusted by baseline covariates.

United States, national administrative database of the Veterans Affairs (VA) health-care system.

Adult incident users of stimulant medications (n = 78 829) from fiscal years (FY) 2001 to 2012.

Primary outcomes were time-to-event: (1) occurrence of AUD diagnosis and (2) death. Baseline covariates included demographic information, Food and Drug Administration (FDA)-approved indications for stimulant use, substance use disorders (SUD) and depression.

Stimulant users compared with non-users were younger, more likely to be non-Hispanic white and female. Incident stimulant medication users increased threefold from FY2001-FY2012 and eightfold among adults aged 18-44 years. Nearly one in 10 incident users in FY2012 had a comorbid baseline SUD. Off-label use was common-nearly three of every five incident users in FY2012. Comorbid SUDs among incident stimulant medication users were risk factors for occurrence of AUD during follow-up, with adjusted hazard ratio (AHR) estimates ranging from 1.54 to 2.83 (Ps < 0.05). Increased mortality risk was observed with occurrence of AUD during follow-up [AHR = 1.55, 95% confidence interval (CI) = 1.13-2.14, P = 0.007], while on-label prescribing was protective against death (AHR = 0.686, 95% CI = 0.63-0.75, P < 0.0001).

In a US national cohort of adult incident stimulant medication users in the Veterans Affairs health-care system, measured from fiscal years 2001 to 2012, comorbid substance use disorders were common and were risk factors for development of an amphetamine use disorder (AUD). Increased mortality risk among incident users of stimulant medications was observed among both those who developed an AUD later and those whose use was defined as off-label.",2018.0
29209667,Narcolepsy in Saudi patients before and after the 2009 H1N1 vaccination. The experience of 2 referral centers.,Qasrawi SQ; Albarrak AM; Alharbi AS; Nashwan S; Almeneessier AS; Pandi-Perumal SR; Alsaadi MM; BaHammam AS,2017 Dec,Saudi medical journal,"To assess the number of Saudi patients diagnosed with narcolepsy in 2 tertiary centers before and after the introduction of the 2009 A(H1N1)pdm09 vaccine.  Methods: We started collecting data after the first international report of an association between the A(H1N1)pdm09 vaccine and narcolepsy between January 2010 and December 2016. All patients diagnosed with narcolepsy after 2009 were included and data were collected for 7 years to account for any possible delays in the diagnosis of narcolepsy.  Results: One-hundred and seventy-three patients with narcolepsy were identified. The majority (144 patients, 83%) had symptom onset before June 2009. Only 29 patients (17%) had symptom onset after 2009. No difference in the annual number of narcolepsy cases was found  before and after 2009. Conclusion: Based on data obtained from 2 tertiary care sleep disorders center, there was no increase in the number of cases of narcolepsy among Saudis following the introduction of the influenza A(H1N1)pdm09 vaccination.",2017.0
29171110,The prevalence of narcolepsy in Catalunya (Spain).,Tió E; Gaig C; Giner-Soriano M; Romero O; Jurado MJ; Sansa G; Pujol M; Sans O; Álvarez-Guerrico I; Caballol N; Jimenez M; Becerra JL; Escartin A; Monasterio C; Molins A; Bove A; Viña J; Iranzo A; Cambrodi R; Calvo G; Morros R; Santamaria J,2018 Oct,Journal of sleep research,"Previous studies have estimated an overall prevalence for narcolepsy between 15 and 70 cases per 100 000 inhabitants. We aimed to estimate the prevalence of narcolepsy in Catalunya (Catalonia), a north-east region of Spain (7 424 754 inhabitants), on 31 December 2014 by identifying all living subjects diagnosed with narcolepsy. First, we identified patients diagnosed by one of the 13 sleep, paediatric or neurological departments that perform tests regularly to diagnose narcolepsy. In a second phase, we searched for additional patients with narcolepsy in a clinical database of the primary health-care system. Clinical files were reviewed and narcolepsy diagnosis validated according to the Brighton Collaboration case definitions. Three hundred and twenty-five patients had a validated diagnosis of narcolepsy in the specialized centres (mean age: 44.6 years, range: 6-89; male: 60.3%; 85% with narcolepsy type 1), including 17.8% cases in Brighton, definition level 1, 62.5% in level 2, 15.4% in level 3 and 4.3% in level 4a. The overall prevalence for narcolepsy was 4.4; 3.7 for narcolepsy type 1 and 0.7 cases per 100 000 inhabitants for narcolepsy type 2. Fifty-six additional narcoleptic patients were identified in the primary health-care system, increasing the overall prevalence to 5.2 cases per 100 000 inhabitants. Prevalence rates for narcolepsy type 1 increased from childhood to adulthood, but in subjects aged more than 50 years there was a substantial drop in prevalence rates, suggesting the presence of a significant pool of undiagnosed cases in this population. Narcolepsy can be considered a rare neurological disorder in Catalunya.",2018.0
29157595,Comorbidity of narcolepsy and depressive disorders: a nationwide population-based study in Taiwan.,Lee MJ; Lee SY; Yuan SS; Yang CJ; Yang KC; Lee TL; Sun CC; Shyu YC; Wang LJ,2017 Nov,Sleep medicine,"Narcolepsy is a chronic sleep disorder that is likely to have neuropsychiatric comorbidities. Depression is a serious mood disorder that affects individuals' daily activities and functions. The current study aimed to investigate the relationship between narcolepsy and depressive disorders.

The study consisted of patients diagnosed with narcolepsy between January 2002, and December 2011 (n = 258), and age-matched and gender-matched controls (n = 2580) from Taiwan's National Health Insurance database. Both the patients and the controls were monitored through December 31, 2011, to identify the occurrence of a depressive disorder. A multivariate logistic regression model was used to assess the narcolepsy's potential influence on the comorbidity of a depressive disorder.

During the study period, 32.7%, 24.8%, and 10.9% of the narcoleptic patients were comorbid with any depressive disorder, dysthymic disorder, and major depressive disorder, respectively. When compared to the control subjects, the patients with narcolepsy were at greater risks of having any depressive disorder (aOR 6.77; 95% CI 4.90-9.37), dysthymic disorder (aOR 6.62; 95% CI 4.61-9.57), and major depressive disorder (aOR 6.83; 95% CI 4.06-11.48). Of the narcoleptic patients that were comorbid with depression, >50% had been diagnosed with depression prior to being diagnosed with narcolepsy.

This nationwide data study revealed that narcolepsy and depression commonly co-occurred. Since some symptoms of narcolepsy overlapped with those of depressive disorders, the findings serve as a reminder that clinicians must pay attention to the comorbidity of narcolepsy and depression.",2017.0
29149785,Association Study of HLA-DQB1*0602 Allele in Iranian Patients with Narcolepsy.,Geremew D; Rahimi-Golkhandan A; Sadeghniiat-Haghighi K; Shakiba Y; Khajeh-Mehrizi A; Ansaripour B; Izad M,2017 Oct,"Iranian journal of allergy, asthma, and immunology","Narcolepsy is a rare, disabling disorder characterized by excessive daytime sleepiness, cataplexy, hypnagogic hallucinations and sleep paralysis. Several studies demonstrated its association with HLA-DQB1*0602 in various ethnic groups. Our study aimed to determine the prevalence of HLA-DQB1*0602 allele in Iranian patients with narcolepsy and assess its predictive parameters for diagnosing narcolepsy. In addition, car accidents and job problems were assessed among narcoleptic patients. We studied 44 narcoleptic patients, 30 patients with other types of excessive daytime sleepiness (EDS)  and 50 healthy age and sex matched individuals in this case-control study. Patients and controls filled out a questionnaire including items about car accidents due to sleepiness and job problems. International classification of sleep disorders-2 criteria was used as the gold standard for diagnosis of narcolepsy. The DNAs isolated from whole blood samples were collected from the patients and controls to assess the presence of HLA-DQB1*0602. The results showed that HLA DQB1*0602 was present in 4 (8%) individual of controls and 20 (45.5%) patients with higher prevalence in patients with cataplexy (78.9%) than patients without cataplexy (p<0.001). The sensitivities of the DQB1*0602 for diagnosing narcolepsy with cataplexy and narcolepsy without cataplexy were 78.9 and 20; specificities were 88 and 72.4, respectively. 18.2% of patients had car accidents due to sleepiness and 68.2% suffered from job problems. Our study shows that evaluation of DQB1*0602 in patients suspected to narcolepsy could be helpful especially in complex cases with atypical cataplexy and indistinguishable multiple sleep latency test MSLT results. Moreover, high rates of car accidents and job problems are found among narcoleptic patients.",2017.0
29117886,A Longitudinal Follow-Up Study on Multiple Sleep Latency Test and Body Mass Index of Patients With Narcolepsy Type 1 in Korea.,Um YH; Kim TW; Jeong JH; Seo HJ; Han JH; Kim SM; Song JH; Hong SC,2017 Dec 15,Journal of clinical sleep medicine : JCSM : official publication of the American Academy of Sleep Medicine,"Narcolepsy is a chronic disorder with numerous adverse long-term consequences including increased obesity, high mortality rates, and decreased quality of life. With emerging attention to the long-term course of the disorder and importance of accurate diagnosis, the diagnostic stability of the Multiple Sleep Latency Test (MSLT)-the mostly frequently used test to identify narcolepsy-is often challenged.

In this study, we compared the baseline and follow-up demographic characteristics and body mass index (BMI) of patients with narcolepsy type 1. Moreover, MSLT results from repeated tests conducted on 48 patients with narcolepsy type 1 were compared, with mean follow-up of approximately 10 years.

BMI from the baseline to the follow-up visit was significantly increased in the participants. There were no significantly different parameter changes in MSLT results.

MSLT has good test-retest validity in patients with narcolepsy type 1. Close surveillance for the detection and management of obesity is warranted in clinical settings.",2017.0
29110977,Clinical Mimics: An Emergency Medicine-Focused Review of Syncope Mimics.,Coleman DK; Long B; Koyfman A,2018 Jan,The Journal of emergency medicine,"Syncope is an event that causes a transient loss of consciousness (LOC) secondary to global cerebral hypoperfusion. The transient nature of the event can make diagnosis in the emergency department (ED) difficult, as symptoms have often resolved by time of initial presentation. The symptoms and presentation of syncope are similar to many other conditions, which can lead to difficulty in establishing a diagnosis in the ED.

This review evaluates patients presenting with a history concerning for possible syncope, mimics of syncope, and approach to managing syncope mimics.

Syncope is caused by transient LOC secondary to global cerebral hypoperfusion. Many conditions can present similarly to syncope, making diagnosis in the ED difficult. Some of the most emergent conditions include seizures, stroke, metabolic disorders, and head trauma. Other nonemergent conditions include cataplexy, pseudosyncope, or deconditioning. Many laboratory studies and imaging can be nondiagnostic during ED evaluation. For patients presenting with apparent syncope, immediate treatment should focus on identifying and treating life-threatening conditions. History and physical examination can help guide further diagnostic evaluation and management.

Patients with apparent syncope should be evaluated for potential immediate life-threatening conditions. A thorough history and physical examination can aid in distinguishing syncope from common mimics and help identify and subsequently treat life-threatening conditions.",2018.0
29099966,Test-Retest Reliability of the Multiple Sleep Latency Test in Central Disorders of Hypersomnolence.,Lopez R; Doukkali A; Barateau L; Evangelista E; Chenini S; Jaussent I; Dauvilliers Y,2017 Dec 1,Sleep,"To assess the test-retest reliability of the polysomnography-multiple sleep latency test (PSG-MSLT) diagnostic classification and measures and to study the determinants of its variability in patients with narcolepsy type 1 (NT1) or with noncataplectic central disorders of hypersomnolence (NCHS): type 2 (NT2), idiopathic hypersomnia (IH), and unspecified hypersomnolence (unspecified excessive daytime sleepiness [UnsEDS]).

PSG-MSLT in drug-free conditions was administered twice (median interval of 1.9 years) in 22 patients with NT1 (10 males, median age 31.2 years) and 75 patients with NCHS (32 males, median age 25.7 years).

At the first PSG-MSLT, patients with NCHS were classified as having NT2 (22.7%), IH (26.7%), or UnsEDS (50.6%). A positive PSG-MSLT was confirmed in 72.7% of NT1. The classification consistency at retesting was significantly lower for the NT2 (47.1%), IH (25.0%), and UnsEDS (42.1%) categories than NT1 (81.3%). The between-test mean sleep latency (MSL) variability was significantly different in NT1 and NCHS, with higher changes in NT2 and lower in NT1. A longer test-retest interval was associated with improved MSL and MSLT normalization. Between-test variations in SOREMP number were associated with changes in nocturnal REM sleep parameters and MSL. No association was found with the clinical decision to repeat the evaluation or the disease clinical course.

The PSG-MSLT measures and classification are not stable in patients with NCHS, with frequent diagnostic changes, particularly for NT2 and IH, compared with NT1. MSLT needs to be repeated at regular intervals to confirm a stable hypersomnia and provide an accurate diagnosis of NT2 and IH.",2017.0
