pmid,title,authors,pubdate,journal,abstract,year
24497656,,,,,"Many cognitive factors contribute to unintentional pedestrian injury, including reaction time, impulsivity, risk-taking, attention, and decision-making. These same factors are negatively influenced by excessive daytime sleepiness (EDS), which may place children with EDS at greater risk for pedestrian injury.

Using a case-control design, 33 children age 8 to 16 y with EDS from an established diagnosis of narcolepsy or idiopathic hypersomnia (IHS) engaged in a virtual reality pedestrian environment while unmedicated. Thirty-three healthy children matched by age, race, sex, and household income served as controls.

Children with EDS were riskier pedestrians than healthy children. They were twice as likely to be struck by a virtual vehicle in the virtual pedestrian environment than healthy controls. Attentional skills of looking at oncoming traffic were not impaired among children with EDS, but decision-making for when to cross the street safely was significantly impaired.

Results suggest excessive daytime sleepiness (EDS) from the clinical sleep disorders known as the hypersomnias of central origin may have significant consequences on children's daytime functioning in a critical domain of personal safety, pedestrian skills. Cognitive processes involved in safe pedestrian crossings may be impaired in children with EDS. In the pedestrian simulation, children with EDS appeared to show a pattern consistent with inattentional blindness, in that they ""looked but did not process"" information in their pedestrian environment. Results highlight the need for heightened awareness of potentially irreversible consequences of untreated sleep disorders and identify a possible target for pediatric injury prevention.",
24426826,,,,,"To examine the impact of gender in narcoleptic patients on timeliness of diagnosis, symptomology, and health and lifestyle impairment.

This is a cross-sectional study of 109 consecutive patients (68 women) with newly diagnosed narcolepsy with and without cataplexy, from a University sleep disorders center. Consecutive patients were administered an 8-page questionnaire at the time of their diagnosis regarding sleep habits, medications, and medical conditions, lifestyle impairments, as well as details regarding narcolepsy-related symptoms.

Men and women presented with remarkably similar narcolepsy related symptoms, yet women were more likely to be delayed in diagnosis; 85% of men were likely to be diagnosed by 16 years after symptom onset, compared to 28 years in women. More women were likely to remain undiagnosed at any given time point after symptom onset (hazard ratio for diagnosis of men compared to women 1.53; 95% CI 1.01-2.32; p = 0.04). Men and women reported similar degree of subjective sleepiness as measured by the Epworth Sleepiness Scale (mean 16.2 ± 4.5; p = 0.18), though women demonstrated significantly more severe objective sleepiness on multiple sleep latency testing (MSLT) (mean sleep latency in women = 5.4 min (± 4.1), in men 7.4 min (± 3.5); p = 0.03). Despite being more objectively sleepy, women were less likely to report lifestyle impairments in the areas of personal relationships (71% men, 44% women, p = 0.01) and physical activity (36% men, 16% women, p = 0.02), but were also more likely to self-medicate with caffeine (63.4% men, 82.4% women; p = 0.03).

Narcolepsy impacts men and women's health and lifestyle differently, and may cause delays diagnosis for women.",
24408296,,,,,"Narcolepsy is a rare sleep disorder. The classical presentation includes the four symptoms excessive daytime sleepiness, cataplexy, sleep paralysis and hypnagogic hallucinations. As a model disease with all the transitions from awake to sleeping conditions, non-rapid eye movement (NREM) and rapid eye movement (REM), it plays an important role in neurology and sleep medicine. Patients with narcolepsy possess a reduced number of hypocretin-producing neurons in the hypothalamus and accordingly the hypocretin level in the cerebrospinal fluid is low. The neuropeptide hypocretin (orexin) has functions, such as the regulation of the sleep-wake cycle, the autonomous nerve system, motor system and metabolic processes. The delay in diagnosing narcolepsy is difficult to comprehend in modern medicine. The frequent association with other sleep-wake disorders may be responsible for the delay. Genomewide association studies have subsequently been able to prove that autoimmune mechanisms are responsible for the manifestation of narcolepsy with the HLA association being the most important for susceptibility and protection. Imaging studies have revealed neurodegenerative changes, making a multifactorial etiopathogenesis probable. The frequent occurrence of metabolic disorders has not yet been clarified. Early diagnosis of narcolepsy has the possibility to offer affected persons an adequate medication to lead an almost normal life and the future possibility to cure narcolepsy through immunomodulation therapy.",
24399620,,,,,"The determination of human leukocyte antigen (HLA) class II genotype is widely used to confirm the diagnosis of narcolepsy with or without cataplexy. The HLA genotyping is reliable, easy to perform and reassures the clinician. It is also less invasive than other methodologies and is in accordance with the autoimmune hypothesis for the origin of narcolepsy. AIM. To assess the usefulness of genetic markers (HLA) in the differential diagnosis between different sleep disorders and their relevance in the context of our population.

We analyzed a cohort of 113 patients with episodes of daytime sleepiness, 38 patients were classified as narcolepsy with cataplexy, 13 as narcolepsy and 62 as hypersomnia/idiopathic hypersomnia. A control population of 206 reportedly healthy individuals from the same geographic origin was used.

The HLA-DQB1*06:02 allele frequency was overrepresented in patients with narcolepsy and narcolepsy with cataplexy (46% and 71% respectively vs. 16% in control population), with a value of p = 4.53-13 for narcolepsy with cataplexy. The HLA-DQB1*02 frequency was increased in the population with hypersomnia when compared with the control population (55% vs. 34%; p = 0.004).

Genetic characterization has the potential to enhance the ability to carry out differential diagnosis among diverse excessive daytime sleepiness phenotypes, corresponding to diverse entities with different biological mechanisms.",
24330987,,,,,"To analyze the clinical diagnosis and treatment process of narcolepsy and epilepsy co-existence, and thereby to improve awareness of such cases.

The clinical manifestations of 2 cases were observed, and video-electroencephalogram (VEEG), multiple sleep latency tests (MSLT) were performed. Hypocretin 1 level in cerebrospinal fluid was examined in one case.

The onset of disease of case one was started with epilepsy with myoclonic seizure. After half a year, catalepsy induced by emotion especially laughing and excessive daytime sleepiness appeared. MSLT was positive and hypocretin 1 level decreased. Narcolepsy-cataplexy was definitely diagnosed in this case. Valproate was given and seizure was controlled completely, but the excessive daytime sleepiness was aggravated. Combination of valproate, methylphenidate and clomipramine treatment improved the symptoms of narcolepsy and the patient was still free of epileptic seizures. The onset symptoms of case 2 were catalepsy and excessive daytime sleepiness. MSLT was positive. The treatment was ineffective because of bad compliance. After 2 years, episodes of impairment of consciousness with automatism occurred. VEEG showed slow waves and spikes in right temporal area. Complex partial seizure was determined. Oxcarbazepine was used and then the patients became seizures free, but the symptoms of narcolepsy were still obvious.

Comorbidity of narcolepsy and epilepsy is a rare phenomenon. Clinical symptoms, predisposing factor, VEEG and MSLT can help diagnosis and differential diagnosis. The antiepileptic drugs might aggravate drowsiness. Based on therapy of epilepsy by using antiepileptic drugs, low dosage of central nervous system stimulants might improve the drowsiness and catalepsy symptoms of narcolepsy.",
24297759,,,,,"Narcolepsy (NA) is a sleep disorder characterized by excessive daytime sleepiness and an increased propensity of rapid eye movement sleep. If left untreated, NA can lead to academic underachievement or job loss because of dozing off or mistakes caused by inattentiveness due to sleepiness.

Although untreated narcolepsy patients may suffer from many social disadvantages due to excessive daytime sleepiness, mostly it takes a long time to receive a definitive diagnosis of the disorder. This retrospective study investigated factors related to the period until definitive diagnosis among patients with narcolepsy in Japan.

We enrolled 181 consecutive patients (108 men, 73 women; mean age 37.6 ± 16.6 years old; narcolepsy with cataplexy/narcolepsy without cataplexy = 131:50). Multivariate logistic regression analysis was performed with period until definitive diagnosis as the dependent variable and descriptive clinical variables as the independent variables.

The mean period until receiving the diagnosis among the participants was 9.9 ± 10.1 years. More than half of the patients first learned about the disorder from information provided by the media. Multivariate logistic analysis indicated that adult onset (p < 0.01), onset in 1995 or later (p < 0.001), and first learning about the disorder from a sleep disorder specialist physician or a general practitioner (p < 0.001) were associated with a time taken for receiving a definitive diagnosis less than or equal to the median value (7 years).

Improving access to information about the concept of the disorder and the medical institutions specialized in sleep disorders, especially via the Internet, would be necessary to promote early diagnosis of the disorder.",
24169281,,,,,"To evaluate the diagnostic value of cerebral spinal fluid (CSF) measurement of hypocretin-1 (hcrt-1) in Chinese patients with narcolepsy.

A total of 139 narcoleptic patients, including 111 narcolepsy with typical cataplexy (NC) and 28 narcolepsy without cataplexy (NWC), were diagnosed at the sleep centre of Peking University People's Hospital from April 2003 to March 2012. And 64 non-narcoleptic controls were recruited. CSF hcrt-1 levels were measured in all subjects.Receiver operating characteristic curve (ROC) was applied to determine the cutoff value of hcrt-1 for Chinese narcoleptic patients. The diagnostic utility of hcrt-1 ≤ 110.0 ng/L and hcrt-1 ≤ 30% of mean normal level defined by International Classification of Sleep Disorders-II and the new Chinese cutoff value were evaluated respectively.

The level of hcrt-1 in narcolepsy patients was significantly lower than that of normal controls and the NC group was even lower than NWC group (20 (13, 36) vs 319 (244, 379) and 36 (15, 114) ng/L) (all P < 0.01).Using the international criteria of CSF hcrt-1 ≤ 110.0 ng/L or a level of 1/3 of mean normal control values, a specificity of 100% and sensitivity of 90.6% were generated.ROC curve indicated that CSF hcrt-1 level of 138.0 ng/L was the best cutoff value for the diagnosis of narcolepsy in Chinese narcoleptic patients. There were a specificity of 100%, a sensitivity of 92.8% and the area under the ROC curve of 0.98.

CSF hcrt-1 measurement with high specificity and sensitivity is a useful diagnostic tool for Chinese narcoleptics. And the level of 138.0 ng/L may be the optimal cutoff for the diagnosis of narcolepsy in this group of patients.",
24144530,,,,,"Insufficient sleep is common in the general population, and can result from environmental and psychosocial factors, medical and psychiatric disorders, and sleep disorders, such as insomnia, circadian rhythm disorders, sleep apnoea and restless legs. Women are particularly at risk for sleep disorders, and complaints of sleep disturbance are more prevalent among women than men across the life span. During the perinatal period, many common sleep disorders, such as obstructive sleep apnoea or restless legs may be exacerbated, or in the case of insomnia or narcolepsy, treatment options may change. In addition, the role of circadian rhythms in fertility and perinatal health is just beginning to be appreciated. In this chapter, we provide an overview of the current knowledge of the unique aspects of diagnosis and treatment of sleep disorders during the perinatal period.",
24142146,,,,,"Our aim was to investigate the natural evolution of cataplexy and polysomnographic features in untreated children with narcolepsy with cataplexy. To this end, clinical, polysomnographic, and cataplexy-video assessments were performed at diagnosis (mean age of 10 ± 3 and disease duration of 1 ± 1 years) and after a median follow-up of 3 years from symptom onset (mean age of 12 ± 4 years) in 21 children with narcolepsy with cataplexy and hypocretin 1 deficiency (tested in 19 subjects). Video assessment was also performed in two control groups matched for age and sex at first evaluation and follow-up and was blindly scored for presence of hypotonic (negative) and active movements. Patients' data at diagnosis and at follow-up were contrasted, compared with controls, and related with age and disease duration. At diagnosis children with narcolepsy with cataplexy showed an increase of sleep time during the 24 h; at follow-up sleep time and nocturnal sleep latency shortened, in the absence of other polysomnographic or clinical (including body mass index) changes. Hypotonic phenomena and selected facial movements decreased over time and, tested against disease duration and age, appeared as age-dependent. At onset, childhood narcolepsy with cataplexy is characterized by an abrupt increase of total sleep over the 24 h, generalized hypotonia and motor overactivity. With time, the picture of cataplexy evolves into classic presentation (i.e., brief muscle weakness episodes triggered by emotions), whereas total sleep time across the 24 h decreases, returning to more age-appropriate levels.",
24134219,,,,,"To investigate the association between vaccination with Pandemrix and risk of selected neurological and immune-related diseases including narcolepsy.

Population-based prospective cohort study using data from regional vaccination registries and national health registries.

Seven healthcare regions in Sweden comprising 61% of the Swedish population.

Study population of 3,347,467 vaccinated and 2,497,572 nonvaccinated individuals (vaccination coverage ≈ 60%) followed between 2009 and 2011 for 6.9 million person-years after exposure and 6.0 million person-years without exposure.

First recorded diagnosis of neurological and immune-related diseases. Relative risks [hazard ratios (HRs) with 95% confidence intervals (CIs)] assessed using Cox regression, adjusted for covariates.

For all selected neurological and immune-related outcomes under study, other than allergic vaccine reactions (for which we verified an expected increase in risk) and narcolepsy, HRs were close to 1.0 and always below 1.3. We observed a three-fold increased risk of a diagnosis of narcolepsy (HR: 2.92, 95% CI: 1.78-4.79; that is, four additional cases per 100,000 person-years) in individuals ≤ 20 years of age at vaccination and a two-fold increase (HR: 2.18, 95% CI: 1.00-4.75) amongst young adults between 21 and 30 years of age. The excess risk declined successively with increasing age at vaccination; no increase in risk was seen after 40 years of age.

For a large number of selected neurological and immune-related diseases, we could neither confirm any causal association with Pandemrix nor refute entirely a small excess risk. We confirmed an increased risk for a diagnosis of narcolepsy in individuals ≤ 20 years of age and observed a trend towards an increased risk also amongst young adults between 21 and 30 years.",
24127148,,,,,"To compare the amounts of REM sleep without atonia (RSWA) between patients with REM sleep behavior disorder (RBD), ""isolated loss of REM atonia,"" narcolepsy, and control subjects and determine if there were threshold values for the amount of RSWA that differentiate each group from controls.

Retrospective analyses of polysomnography (PSG) records were used employing strict quantitative criteria for the measurement of phasic and tonic EMG activity during REM sleep. The PSG recordings of 47 individuals were analyzed (RBD 16, isolated loss of REM atonia 11, narcolepsy 10, control 10).

Patients with the diagnosis of isolated loss of REM atonia had significantly lower levels of EMG activity during REM sleep than those with RBD but higher than control subjects. RSWA was higher in narcolepsy than in loss of REM atonia but lower than for RBD patients. Receiver operating characteristic (ROC) curves provided threshold values with high specificity and sensitivity in all patient groups with a cutoff value ≥ 1.22% (100% correctly classified) for phasic and ≥ 3.17% for tonic (92% correctly classified) EMG activity in RBD.

Quantification of REM sleep EMG activity can successfully differentiate RBD and isolated loss of REM atonia patients from controls. The consistently increased amount of RSWA in patients with narcolepsy indicates that this can be an additional marker for a diagnosis of narcolepsy. Longitudinal studies of patients with isolated loss of REM atonia are needed to evaluate if these patients are at risk of developing RBD or neurodegenerative disorders.",
24095163,,,,,,
23946711,,,,,"Narcolepsy is reported to affect 26-56/100,000 in the general population. We aimed to describe clinical and polysomnographic features of a large narcolepsy cohort in order to comprehensively characterize the narcoleptic spectrum.

We performed a chart- and polysomnographybased review of all narcolepsy patients of the Innsbruck narcolepsy cohort.

A total of 100 consecutive narcolepsy patients (87 with cataplexy [NC], 13 without cataplexy [N]) were included in the analysis. All subjects had either excessive daytime sleepiness or cataplexy as their initial presenting clinical feature. Age at symptom onset was 20 (6-69) years. Diagnostic delay was 6.5 (0-39) years. The complete narcolepsy tetrad was present in 36/100 patients; 28/100 patients had three cardinal symptoms; 29/100 had two; and 7/100 had only excessive daytime sleepiness. Severity varied broadly with respect to excessive daytime sleepiness (median Epworth Sleepiness Scale score: 18, range 10-24), cataplexy (8-point Likert scale: median 4.5, range 1-8), hypnagogic hallucinations (median 4.5, range 1-7), and sleep paralysis (median 3, range 1-7). Sleep comorbidity was highly prevalent and ranged from sleeprelated movement disorders (n = 55/100), parasomnias (n = 34/100), and sleeprelated breathing disorders (n = 24/100), to insomnia (n = 28/100). REM sleep without atonia or a periodic limb movement in sleep index > 5/h were present in most patients (90/100 and 75/100). A high percentage of narcoleptic patients in the present study had high frequency leg movements (35%) and excessive fragmentary myoclonus (22%). Of the narcolepsy patients with clinical features of REM sleep behavior disorder (RBD), 76.5% had EMG evidence for RBD on the multiple sleep latency test (MSLT), based on a standard cutoff of a minimum of 18% of 3-sec miniepochs.

This study is one of the largest monocentric polysomnographic studies to date of patients with narcolepsy and confirms the frequent comorbidity of narcolepsy with many other sleep disorders. Our study is the first to evaluate the percentage of patients with high frequency leg movements and excessive fragmentary myoclonus in narcolepsy and is the first to demonstrate EMG evidence of RBD in the MSLT. These findings add to the growing body of literature suggesting that motor instability is a key feature of narcolepsy.",
23946709,,,,,"Differentiation of narcolepsy without cataplexy from idiopathic hypersomnia relies entirely upon the multiple sleep latency test (MSLT). However, the test-retest reliability for these central nervous system hypersomnias has never been determined.

Patients with narcolepsy without cataplexy, idiopathic hypersomnia, and physiologic hypersomnia who underwent two diagnostic multiple sleep latency tests were identified retrospectively. Correlations between the mean sleep latencies on the two studies were evaluated, and we probed for demographic and clinical features associated with reproducibility versus change in diagnosis.

Thirty-six patients (58% women, mean age 34 years) were included. Inter -test interval was 4.2 ± 3.8 years (range 2.5 months to 16.9 years). Mean sleep latencies on the first and second tests were 5.5 (± 3.7 SD) and 7.3 (± 3.9) minutes, respectively, with no significant correlation (r = 0.17, p = 0.31). A change in diagnosis occurred in 53% of patients, and was accounted for by a difference in the mean sleep latency (N = 15, 42%) or the number of sleep onset REM periods (N = 11, 31%). The only feature predictive of a diagnosis change was a history of hypnagogic or hypnopompic hallucinations.

The multiple sleep latency test demonstrates poor test-retest reliability in a clinical population of patients with central nervous system hypersomnia evaluated in a tertiary referral center. Alternative diagnostic tools are needed.",
23940246,,,,,"Rapid-onset obesity with hypothalamic dysfunction, hypoventilation, and autonomic dysregulation (ROHHAD) is a rare and complex pediatric syndrome, essentially caused by dysfunction of 3 vital systems regulating endocrine, respiratory, and autonomic nervous system functioning. The clinical spectrum of ROHHAD is broad, but sleep/wake disorders have received relatively little attention so far, although the central hypothalamic dysfunction would make the occurrence of sleep symptoms likely. In this case report, we expand the phenotype of ROHHAD with a number of striking sleep symptoms that together can be classified as a secondary form of narcolepsy. We present a 7-year-old girl with ROHHAD who displayed the classic features of narcolepsy with cataplexy: excessive daytime sleepiness with daytime naps, visual hallucinations, and partial cataplexy reflected in intermittent loss of facial muscle tone. Nocturnal polysomnography revealed sleep fragmentation and a sleep-onset REM period characteristic for narcolepsy. The diagnosis was confirmed by showing an absence of hypocretin-1 in the cerebrospinal fluid. We discuss potential pathophysiological implications as well as symptomatic treatment options.",
23904686,,,,,"Autosomal dominant cerebellar ataxia, deafness and narcolepsy (ADCA-DN) is caused by DNMT1 mutations. Diagnosing the syndrome can be difficult, as all clinical features may not be present at onset, HLA-DQB1*06:02 is often negative, and sporadic cases occur. We report on clinical and genetic findings in a 31-year-old woman with cerebellar ataxia, deafness, and narcolepsy, and discuss diagnostic challenges.

Clinical and genetic investigation in a patient and family members.

Ataxia clinic, São Paulo, Brazil.

One patient and her family members.

N/A.

Narcolepsy was supported by polysomnographic and multiple sleep latency testing. HLA-DQB1*06:02 was positive. CSF hypocretin-1 was 191 pg/mL (normal values > 200 pg/mL). Mild brain atrophy was observed on MRI, with cerebellar involvement. The patient, her asymptomatic mother, and 3 siblings gave blood samples for genetic analysis. DNMT1 exons 20 and 21 were sequenced. Haplotyping of polymorphic markers surrounding the mutation was performed. The proband had a novel DNMT1 mutation in exon 21, p.Cys596Arg, c.1786T > C. All 4 parental haplotypes could be characterized in asymptomatic siblings without the mutation, indicating that the mutation is de novo in the patient.

The Brazilian patient reported here further adds to the worldwide distribution of ADCA-DN. The mutation is novel, and illustrates a sporadic case with de novo mutation. We believe that many more cases with this syndrome are likely to be diagnosed in the near future, mandating knowledge of this condition and consideration of the diagnosis.",
